{
  "$id": "crm.event.customer.created.schema.json",
  "$schema": "https://json-schema.org/draft/2020-12/schema",
  "x-revision": "2026-06-22",
  "x-status": "draft",
  "title": "CRM Event customer created",
  "description": "Schema for customer created events in CRM.",
  "type": "object",
  "unevaluatedProperties": false,
  "required": [
    "messageVersion",
    "sourceSystem",
    "objectType",
    "operation",
    "occurredAt",
    "payload"
  ],
  "properties": {
        "messageVersion": {
        "type": "string",
        "pattern": "^\\d+\\.\\d+$",
        "description": "Message contract version.",
        "x-status": "draft"
        },
        "sourceSystem": {
        "type": "string",
        "description": "Source system that generated the event.",
        "const": "CRM"
        },
        "objectType": {
        "type": "string",
        "description": "Type of business object affected by the event.",
        "const": "customer"
        },
        "operation": {
        "type": "string",
        "description": "Business operation that occurred in the source system.",
        "const": "created"
        },
        "occurredAt": {
        "type": "string",
        "format": "date-time",
        "description": "Timestamp when the business event occurred in the source system."
        },
        "payload": {
            "description": "Event payload. Contains the data of the created customer.",
            "type": "object",
                "allOf": [
                  { "$ref": "../../../../model/customer/customer.common.schema.json" },
                  { "$ref": "../../../../model/customer/customer.crm.schema.json" }
          ]
        }
    }
}
