{
  "messageVersion": "1.0",
  "sourceSystem": "CRM",
  "objectType": "customer",
  "operation": "created",
  "occurredAt": "2026-06-23T09:25:00Z",
  "payload": {
    "id": "f1c4b7c8-2e9a-4d8a-8d9e-1a2b3c4d5e6f",
    "crmCustomerNumber": "A12345",
    "name1": "Muster Hotel GmbH",
    "address1": "Hotelstraße 1",
    "postalCode": "6020",
    "city": "Innsbruck",
    "countryCode": "AT",
    "geoLocation": {
      "latitude": 47.2692,
      "longitude": 11.4041
    },
    "phoneNumber1": "+43512555123",
    "phoneNumber2": "+43512555124",
    "emailAddress": "office@musterhotel.at",
    "responsibilityCenterId": "8f5c1234-0dde-4b87-b31b-4d5f256ff0e2",
    "blockedFor": "shipping",
    "blockedForReason": "Customer requested temporary shipping block",
    "languageTag": "de-AT",
    "timezone": "Europe/Vienna",
    "taxNumbers": {
      "vatNumber": "ATU12345678",
      "eoriNumber": "AT1234567890",
      "taxNumber1": "TAX-001",
      "taxNumber2": "TAX-002"
    },

    "roles": [
      "reseller"
    ],
    "customerRelations": {
      "reseller": {
        "ancestorCustomerId": null
      },
      "invoiceRecipient": {
        "ancestorCustomerId": "1c2e70e7-9b2c-4e72-a43e-16501e23e16a"
      },
      "conditionOwner": {
        "ancestorCustomerId": "22d33cd9-32f7-44a5-99db-b16d2cfcf024"
      },
      "parent": {
        "ancestorCustomerId": "03e1bd90-398b-4d4b-b860-e7741695eac5"
      }
    },
    "homepage": "https://www.alpenblick.at",
    "currency": "EUR",
    "shippingInstruction": "Complete",
    "isPremiumCustomer": false,
    "salesFunnelStage": "ExistingCustomer",
    "defaultCustomerReference": "REF-1001",
    "requestForErpCustomerBlock": false,
    "ourContactPersons": {
      "salesPersonEmployeeId": "4b7b24f1-2cb9-4a1d-9d2c-4e0f0f2f7e11",
      "advisorId": "2c2e9964-65b6-4ca2-95ef-ca18192f9e70",
      "personInChargeId": "6e5a0c32-e8ff-4484-a4fd-82b5d8f8d632"
    },
    "shippingAgentCode": "DHL",
    "classifications": {
      "salesClass": "S1",
      "potential": "P2",
      "divisionCode": "DIV1",
      "subdivisionCode": "SUBDIV01"
    },
    "billingAndPayment": {
      "customerPriceGroupId": "31f2fa8a-6511-4f18-a877-42eb4a0c0494",
      "isPriceGroupCustomer": true,
      "priceBookGroupId": "1eb6db41-55c7-4c0d-8f01-1b2fbc5dd29a",
      "ignoreMaterialSurcharge": false,
      "excludeFromMinQuantitySurcharge": true,
      "salesOnlyWithSpecialPrice": false,
      "orderLimitActive": true,
      "combineShipments": true,
      "purchasingAssociation": false,
      "bundleReturn": true,
      "paymentTermsId": "f7362e0d-3451-4b44-a6d0-7532d2a12bd2",
      "paymentMethodCode": "BANK",
      "creditStandingCode": "GOOD",
      "creditStandingCheckStatus": "Checked",
      "creditStandingCheckDate": "2026-06-23T09:25:00Z"
    },
    "customerGroupMembership": {
      "customerGroupId": "2ef80f1d-794f-4f72-b5de-6d39f3e605cf",
      "membershipNumber": "M1001",
      "glnMembershipNumber": "GLN1001",
      "membershipSince": "2024-01-01",
      "membershipUntil": "2026-12-31",
      "bonusGroup": "BASIC",
      "purchaseGroup": "WHOLESALE",
      "billersInvoiceRecipientId": "INV-1001"
    },
    "openingHours": {
      "intervals": [
        {
          "seasonCode": "Summer",
          "area": "Salesperson",
          "startingDate": "2026-01-01",
          "endingDate": "2026-12-31",
          "days": [
            {
              "opensAt": "08:00",
              "closesAt": "16:00",
              "weekdays": [
                "monday",
                "tuesday",
                "wednesday",
                "thursday",
                "friday"
              ]
            },
            {
              "opensAt": "09:00",
              "closesAt": "12:00",
              "weekdays": [
                "saturday"
              ]
            }
          ]
        }
      ],
      "closingDays": [
        {
          "startAt": "2026-12-24T12:00:00Z",
          "endAt": "2026-12-26T23:59:59Z",
          "seasonCode": null,
          "area": null,
          "reason": "Christmas closure"
        }
      ]
    },
    "createdAt": "2026-06-23T09:00:00Z",
    "createdById": "11111111-1111-4111-8111-111111111111",
    "contentHash": "8d969eef6ecad3c29a3a629280e686cff8fab7f5f2b7fcb8b0b3e3c8c5b4c7d2"
  }
}